{
  "schema_version": "v2.0",
  "day": 5,
  "date": "2026-06-05",
  "city_id": "dali",
  "city_name": "Dali",
  "leg_index": 2,
  "day_type": "city-change",
  "stage": "user-selected",
  "arrival_ts": "2026-06-05T11:00:00+08:00",
  "departure_ts": "2026-06-05T08:30:00+08:00",
  "slots": {
    "breakfast": {
      "slot_id": "breakfast",
      "options": [],
      "selected_option_id": null,
      "skipped": true,
      "skipped_reason": "pre-arrival"
    },
    "morning_activity": {
      "slot_id": "morning_activity",
      "options": [],
      "selected_option_id": null,
      "skipped": true,
      "skipped_reason": "pre-arrival"
    },
    "lunch": {
      "slot_id": "lunch",
      "options": [
        {"option_id": "l1", "name": "Cangshan Mountain Noodle House", "location_summary": "Dali Old Town", "cost": 80, "fit_score": 0.86, "why_fits_user": "Local Bai noodles, gentle for arrival lunch", "source_agent": "meals", "city_context": {"city_id": "dali", "city_name": "Dali", "leg_index": 2, "role": "destination", "valid_after_ts": "2026-06-05T11:00:00+08:00"}},
        {"option_id": "l2", "name": "Erhai Lake Bai Restaurant", "location_summary": "Erhai shore", "cost": 120, "fit_score": 0.84, "why_fits_user": "Lakeside Bai cuisine", "source_agent": "meals", "city_context": {"city_id": "dali", "city_name": "Dali", "leg_index": 2, "role": "destination", "valid_after_ts": "2026-06-05T11:00:00+08:00"}}
      ],
      "selected_option_id": "l1",
      "skipped": false,
      "skipped_reason": null
    },
    "afternoon_activity": {
      "slot_id": "afternoon_activity",
      "options": [
        {"option_id": "aa1", "name": "Dali Old Town walking", "location_summary": "Old Town", "cost": 0, "fit_score": 0.9, "why_fits_user": "Easy stroll for arrival afternoon", "source_agent": "attractions", "city_context": {"city_id": "dali", "city_name": "Dali", "leg_index": 2, "role": "destination"}}
      ],
      "selected_option_id": "aa1",
      "skipped": false,
      "skipped_reason": null
    },
    "dinner": {
      "slot_id": "dinner",
      "options": [
        {"option_id": "d1", "name": "Bai-style Cured Pork Hotpot", "location_summary": "Old Town", "cost": 200, "fit_score": 0.9, "why_fits_user": "Signature Bai dish", "source_agent": "meals", "city_context": {"city_id": "dali", "city_name": "Dali", "leg_index": 2, "role": "overnight"}},
        {"option_id": "d2", "name": "Three Course Tea Restaurant", "location_summary": "Cangshan foothills", "cost": 240, "fit_score": 0.87, "why_fits_user": "Bai tea ceremony combined with dinner", "source_agent": "meals", "city_context": {"city_id": "dali", "city_name": "Dali", "leg_index": 2, "role": "overnight"}}
      ],
      "selected_option_id": "d1",
      "skipped": false,
      "skipped_reason": null
    },
    "evening_activity": {
      "slot_id": "evening_activity",
      "options": [
        {"option_id": "ea1", "name": "Erhai Lake Stargazing", "location_summary": "Erhai dock", "cost": 0, "fit_score": 0.92, "why_fits_user": "Quiet stargazing matches INFJ contemplative preference", "source_agent": "entertainment", "city_context": {"city_id": "dali", "city_name": "Dali", "leg_index": 2, "role": "overnight"}}
      ],
      "selected_option_id": "ea1",
      "skipped": false,
      "skipped_reason": null
    }
  },
  "accommodation": {
    "slot_id": "accommodation",
    "options": [
      {"option_id": "h1", "name": "Erhai Boutique Inn", "location_summary": "Erhai shore", "cost": 720, "fit_score": 0.93, "why_fits_user": "Lakefront boutique inn, INFJ aesthetic", "source_agent": "accommodation", "city_context": {"city_id": "dali", "city_name": "Dali", "leg_index": 2, "role": "overnight"}},
      {"option_id": "h2", "name": "Cangshan Garden Lodge", "location_summary": "Cangshan foothills", "cost": 580, "fit_score": 0.88, "why_fits_user": "Mountain garden lodge", "source_agent": "accommodation", "city_context": {"city_id": "dali", "city_name": "Dali", "leg_index": 2, "role": "overnight"}},
      {"option_id": "h3", "name": "Old Town Wenyi Hostel-Boutique", "location_summary": "Old Town", "cost": 420, "fit_score": 0.84, "why_fits_user": "Wenyi atmosphere, social common room", "source_agent": "accommodation", "city_context": {"city_id": "dali", "city_name": "Dali", "leg_index": 2, "role": "overnight"}}
    ],
    "selected_option_id": "h1",
    "skipped": false,
    "skipped_reason": null
  },
  "intra_city_routes": {},
  "warnings": []
}
