{
  "schema_version": "v2.0",
  "day": 3,
  "date": "2026-06-03",
  "city_id": "lijiang",
  "city_name": "Lijiang",
  "leg_index": 1,
  "day_type": "arrival",
  "stage": "user-selected",
  "arrival_ts": "2026-06-03T15:30:00+08:00",
  "departure_ts": null,
  "slots": {
    "breakfast": {
      "slot_id": "breakfast",
      "options": [],
      "selected_option_id": null,
      "skipped": true,
      "skipped_reason": "pre-arrival"
    },
    "morning_activity": {
      "slot_id": "morning_activity",
      "options": [],
      "selected_option_id": null,
      "skipped": true,
      "skipped_reason": "pre-arrival"
    },
    "lunch": {
      "slot_id": "lunch",
      "options": [],
      "selected_option_id": null,
      "skipped": true,
      "skipped_reason": "pre-arrival"
    },
    "afternoon_activity": {
      "slot_id": "afternoon_activity",
      "options": [
        {"option_id": "aa1", "name": "Lijiang Old Town Stroll", "location_summary": "Old Town", "cost": 0, "fit_score": 0.9, "why_fits_user": "Gentle landing day; Naxi cobblestone streets fit INFJ artsy preference", "source_agent": "attractions", "city_context": {"city_id": "lijiang", "city_name": "Lijiang", "leg_index": 1, "role": "destination", "valid_after_ts": "2026-06-03T15:30:00+08:00"}}
      ],
      "selected_option_id": "aa1",
      "skipped": false,
      "skipped_reason": null
    },
    "dinner": {
      "slot_id": "dinner",
      "options": [
        {"option_id": "d1", "name": "Naxi Family Kitchen", "location_summary": "Old Town", "cost": 180, "fit_score": 0.91, "why_fits_user": "Authentic Naxi cuisine in family setting", "source_agent": "meals", "city_context": {"city_id": "lijiang", "city_name": "Lijiang", "leg_index": 1, "role": "overnight"}},
        {"option_id": "d2", "name": "Sifang Street Hotpot", "location_summary": "Old Town", "cost": 200, "fit_score": 0.84, "why_fits_user": "Yunnan mushroom hotpot specialty", "source_agent": "meals", "city_context": {"city_id": "lijiang", "city_name": "Lijiang", "leg_index": 1, "role": "overnight"}},
        {"option_id": "d3", "name": "Lijiang Local Tavern", "location_summary": "Wuyi Street", "cost": 160, "fit_score": 0.81, "why_fits_user": "Local tavern with live Naxi music", "source_agent": "meals", "city_context": {"city_id": "lijiang", "city_name": "Lijiang", "leg_index": 1, "role": "overnight"}},
        {"option_id": "d4", "name": "Jadestone Bridge Eatery", "location_summary": "Old Town", "cost": 140, "fit_score": 0.78, "why_fits_user": "River-side dinner spot", "source_agent": "meals", "city_context": {"city_id": "lijiang", "city_name": "Lijiang", "leg_index": 1, "role": "overnight"}}
      ],
      "selected_option_id": "d1",
      "skipped": false,
      "skipped_reason": null
    },
    "evening_activity": {
      "slot_id": "evening_activity",
      "options": [
        {"option_id": "ea1", "name": "Square Street Lantern Walk", "location_summary": "Old Town", "cost": 0, "fit_score": 0.87, "why_fits_user": "Lantern-lit alleys, classic INFJ wenyi atmosphere", "source_agent": "entertainment", "city_context": {"city_id": "lijiang", "city_name": "Lijiang", "leg_index": 1, "role": "overnight"}}
      ],
      "selected_option_id": "ea1",
      "skipped": false,
      "skipped_reason": null
    }
  },
  "accommodation": {
    "slot_id": "accommodation",
    "options": [
      {"option_id": "h1", "name": "Boutique Naxi Courtyard", "location_summary": "Old Town", "cost": 600, "fit_score": 0.93, "why_fits_user": "Boutique Naxi-style courtyard, INFJ aesthetic", "source_agent": "accommodation", "city_context": {"city_id": "lijiang", "city_name": "Lijiang", "leg_index": 1, "role": "overnight"}},
      {"option_id": "h2", "name": "Wuhua Yard Inn", "location_summary": "Wuhua Street", "cost": 480, "fit_score": 0.87, "why_fits_user": "Quiet courtyard with garden", "source_agent": "accommodation", "city_context": {"city_id": "lijiang", "city_name": "Lijiang", "leg_index": 1, "role": "overnight"}},
      {"option_id": "h3", "name": "Lijiang Cultural Boutique", "location_summary": "Sifang Square", "cost": 720, "fit_score": 0.85, "why_fits_user": "Centrally located boutique with cultural decor", "source_agent": "accommodation", "city_context": {"city_id": "lijiang", "city_name": "Lijiang", "leg_index": 1, "role": "overnight"}}
    ],
    "selected_option_id": "h1",
    "skipped": false,
    "skipped_reason": null
  },
  "intra_city_routes": {},
  "warnings": []
}
