{
  "schema_version": "v2.0",
  "day": 3,
  "date": "2026-06-22",
  "city_id": "lijiang",
  "city_name": "Lijiang",
  "leg_index": 1,
  "day_type": "city-change",
  "stage": "user-selected",
  "arrival_ts": "2026-06-22T12:22:00+08:00",
  "departure_ts": "2026-06-22T09:14:00+08:00",
  "slots": {
    "breakfast": {
      "slot_id": "breakfast",
      "options": [
        {
          "option_id": "breakfast-3-1",
          "name": "Chenxi Tofu Rice Noodles (Qianjujie Street, Kunming)",
          "name_local": "晨曦豆花米线(钱局街)",
          "location_summary": "Qianjujie Street area, near Cuihu Lake, Wuhua District, Kunming",
          "cost": 13.0,
          "fit_score": 0.85,
          "why_fits_user": "Before taking the morning high-speed train Kunming→Lijiang (~3h), grab quintessential Kunming breakfast.",
          "source_agent": "meals",
          "city_context": {
            "city_id": "lijiang",
            "city_name": "Lijiang",
            "leg_index": 1,
            "role": "destination"
          },
          "location_local": "昆明市钱局街(翠湖附近)",
          "currency_local": "CNY",
          "cuisine_base": "Yunnan Breakfast / Tofu Rice Noodles",
          "cuisine_local": "云南早点 / 豆花米线",
          "signature_dishes_base": "Tofu Flower Rice Noodles (豆花米线), Yunnan Pickled Vegetables, Chili Oil",
          "signature_dishes_local": "豆花米线, 云南腌菜, 辣椒油",
          "notes_local": "高铁去丽江前的昆明早点。小红书翠湖美食帖专门提到钱局街豆花米线不可错过，9点开门，约13元，真正本地人排队的早点摊。",
          "optional": false,
          "search_results": [
            {
              "skill": "rednote",
              "type": "note_detail",
              "url": "https://xhs.life-ai.app/explore/6902e5d20000000004010980",
              "display_text": "小红书 - 昆明翠湖钱局街美食帖"
            }
          ]
        }
      ],
      "selected_option_id": "breakfast-3-1",
      "skipped": false,
      "skipped_reason": null
    },
    "morning_activity": {
      "slot_id": "morning_activity",
      "options": [],
      "selected_option_id": null,
      "skipped": true,
      "skipped_reason": "city-change"
    },
    "lunch": {
      "slot_id": "lunch",
      "options": [
        {
          "option_id": "lunch-3-1",
          "name": "On-Train Packed Lunch / Lijiang Station Snacks",
          "name_local": "高铁便当/丽江站小吃",
          "location_summary": "Kunming to Lijiang high-speed train or Lijiang station",
          "cost": 30.0,
          "fit_score": 0.85,
          "why_fits_user": "Kunming to Lijiang by high-speed rail ~3 hours.",
          "source_agent": "meals",
          "city_context": {
            "city_id": "lijiang",
            "city_name": "Lijiang",
            "leg_index": 1,
            "role": "destination"
          },
          "location_local": "昆明至丽江高铁途中或丽江高铁站",
          "currency_local": "CNY",
          "cuisine_base": "Train Lunch / Station Snacks",
          "cuisine_local": "高铁便当/站台小吃",
          "signature_dishes_base": "Train lunchbox, local station snacks",
          "signature_dishes_local": "高铁盒饭, 站台小吃",
          "notes_local": "昆明高铁约3小时到丽江，午饭在车上解决。抵达后直接入住，晚上再好好吃一顿。",
          "optional": true,
          "search_results": []
        }
      ],
      "selected_option_id": "lunch-3-1",
      "skipped": false,
      "skipped_reason": null
    },
    "afternoon_activity": {
      "slot_id": "afternoon_activity",
      "options": [],
      "selected_option_id": null,
      "skipped": true,
      "skipped_reason": "city-change"
    },
    "dinner": {
      "slot_id": "dinner",
      "options": [
        {
          "option_id": "dinner-3-1",
          "name": "Jinweiyuan Naxi Cuisine (Yishang Street, Lijiang Old Town)",
          "name_local": "金味园纳西菜馆(义尚街)",
          "location_summary": "76 Wenming Alley, Yishang Street, Gucheng District, Lijiang",
          "cost": 80.0,
          "fit_score": 0.85,
          "why_fits_user": "First dinner in Lijiang after settling in.",
          "source_agent": "meals",
          "city_context": {
            "city_id": "lijiang",
            "city_name": "Lijiang",
            "leg_index": 1,
            "role": "destination"
          },
          "location_local": "丽江市古城区义尚街文明巷76号",
          "currency_local": "CNY",
          "cuisine_base": "Naxi Traditional Cuisine",
          "cuisine_local": "纳西传统菜",
          "signature_dishes_base": "Naxi Roast Fish (纳西烤鱼), Porcini Mushroom Stir-fry (牛肝菌炒), Yak Meat (牦牛肉), Water Shield Weed (水性杨花)",
          "signature_dishes_local": "纳西烤鱼, 牛肝菌炒肉, 爆炒牦牛肉, 水性杨花",
          "notes_local": "抵达丽江第一顿正式晚饭。小红书验证为「本地人才知道的纳西菜馆」，义尚街老城区，不是游客聚集地。食材地道家常，为明天玉龙雪山大日子储能。",
          "optional": false,
          "search_results": [
            {
              "skill": "rednote",
              "type": "note_search",
              "url": "https://www.xiaohongshu.com/search_result?keyword=%E4%B8%BD%E6%B1%9F%E7%BA%B3%E8%A5%BF%E8%8F%9C%E9%A6%86+%E6%9C%AC%E5%9C%B0",
              "display_text": "小红书 - 丽江纳西菜馆本地推荐"
            }
          ]
        }
      ],
      "selected_option_id": "dinner-3-1",
      "skipped": false,
      "skipped_reason": null
    },
    "evening_activity": {
      "slot_id": "evening_activity",
      "options": [
        {
          "option_id": "evening_activity-3-1",
          "name": "Lijiang Old Town Night Walk - Four Square Street",
          "name_local": "丽江古城夜游·四方街",
          "location_summary": "Four Square Street, Lijiang Old Town, Lijiang, Yunnan",
          "cost": 0.0,
          "fit_score": 0.78,
          "why_fits_user": "Arrival day in Lijiang — keep the evening gentle.",
          "source_agent": "entertainment",
          "city_context": {
            "city_id": "lijiang",
            "city_name": "Lijiang",
            "leg_index": 1,
            "role": "destination"
          },
          "location_local": "云南省丽江市古城区丽江古城四方街",
          "currency_local": "CNY",
          "type_base": "Night Walk",
          "type_local": "夜间散步",
          "note_local": "丽江第一夜，石板路灯笼光流水声，轻松散步感受古城气氛",
          "notes_local": "到达丽江第一天，适合轻松感受古城。入住后从四方街出发，沿新义街、五一街漫步。夜晚人少，石灯小桥流水，气氛温馨浪漫。古城本身免费，随心散步。INFJ适合度：高——灯光柔和，节奏随意，零压力。",
          "optional": false,
          "search_results": []
        }
      ],
      "selected_option_id": "evening_activity-3-1",
      "skipped": false,
      "skipped_reason": null
    }
  },
  "accommodation": {
    "slot_id": "accommodation",
    "options": [
      {
        "option_id": "accommodation-3-1",
        "name": "Jijian·Xiangwang SOOOAN Snow Mountain Luxury Villa Resort (Lijiang Wenbicun)",
        "name_local": "既见·象罔SOOOAN雪山隐奢度假酒店（丽江文笔村）",
        "location_summary": "Wenbicun Village Group 1, Wenhua Community, Huangshan Street, Lijiang, Yunnan",
        "cost": 1800.0,
        "fit_score": 0.9,
        "why_fits_user": "小红书 1036 likes (汤忆TANG, verified).",
        "source_agent": "accommodation",
        "city_context": {
          "city_id": "lijiang",
          "city_name": "Lijiang",
          "leg_index": 1,
          "role": "destination"
        },
        "location_local": "云南省丽江市古城区黄山街道文华居委会文笔村一组1号",
        "currency_local": "CNY",
        "type_base": "小红书-Verified Luxury Boutique Resort (小红书网红隐奢度假酒店)",
        "type_local": "小红书网红隐奢度假酒店",
        "amenities_base": [
          "Rooftop infinity pool with jellyfish lights (水母灯)",
          "Jade Dragon Snow Mountain panoramic views from rooms",
          "In-room meadow/pastoral views",
          "Pastoral barn-style cafe (牛棚咖啡厅)",
          "Airport/station pickup service",
          "Non-intangible heritage craft experience",
          "Nightly aromatherapy + steam eye mask amenities",
          "WiFi",
          "Air conditioning",
          "Full breakfast included"
        ],
        "amenities_local": [
          "屋顶无边泳池（水母灯浮水装置）",
          "客房直面玉龙雪山全景",
          "田野牧场视野",
          "牛棚咖啡厅",
          "机场/车站接送服务",
          "非遗手作体验",
          "晚安香薰+蒸汽眼罩",
          "WiFi",
          "空调",
          "早餐含早"
        ],
        "stars": 5.0,
        "check_in": "15:00",
        "check_out": "12:00",
        "notes_local": "小红书1036点赞（汤忆TANG亲测）。丽江「梦幻田园式高级」首选。引用原文：「油画般的窗景，躺着看日照金山，生活真的需要一些幸福的时刻！」/「在蓝调时刻来到屋顶的无边泳池，被漂浮的水母灯美到失语，远处的雪山若隐若现，旅行的诗意在此刻具象化了！」真正「可以待一天」：屋顶无边泳池+水母灯、牛棚咖啡厅、田野牧场风景、非遗手作体验。位于文笔村，距玉龙雪山15分钟车程（完美契合第四天）。INFJ气质：油画感雪山+田野独处+水母梦幻意境。预估1500-2500元/晚，3晚合计约4500-7500元。",
        "optional": false,
        "search_results": [
          {
            "skill": "rednote",
            "type": "note",
            "url": "https://xhs.life-ai.app/explore/68775fcc000000020d02df46?xsec_token=AB6ii8e3RBwITUQPgNQ8UKrpUYLD-3LHrVuKoC_VABEME%3D",
            "display_text": "小红书 - 住进油画里的雪山秘境，躺着看日照金山 (汤忆TANG · 1036点赞)"
          },
          {
            "skill": "rednote",
            "type": "note",
            "url": "https://xhs.life-ai.app/explore/686ba192000000002400957c?xsec_token=ABoS8xTqRIMJmXtfca9bKXFwS6gHSOrj6Tq2abC1HUtVY%3D",
            "display_text": "小红书 - 云南行住宿篇 (只想当咸鱼 · 679点赞)"
          }
        ]
      }
    ],
    "selected_option_id": "accommodation-3-1",
    "skipped": false,
    "skipped_reason": null
  },
  "intra_city_routes": {},
  "warnings": []
}